<?xml version="1.0"?>
<!DOCTYPE Report
[
<!ELEMENT Report (General ,(Doc|BPT)) >
<!ATTLIST Report ver CDATA #REQUIRED tmZone CDATA #REQUIRED>

<!ELEMENT General ( DocLocation ) >
<!ATTLIST General productName CDATA #REQUIRED productVer CDATA #REQUIRED os CDATA #REQUIRED host CDATA #REQUIRED qcserver CDATA #IMPLIED qcproject CDATA #IMPLIED SolManSolutionId CDATA #IMPLIED SolManProjectId CDATA #IMPLIED SolManTestPlanId CDATA #IMPLIED SolManTestPackageId CDATA #IMPLIED SolManUserInfoData CDATA #IMPLIED  >

<!ELEMENT BPT (DName,Res,DVer?,TSet?,TInst?,NodeArgs,AdditionalInfo*,Doc*) >
<!ATTLIST BPT rID ID #REQUIRED >

<!ELEMENT Doc (DName,ConfName?,Res,DVer?,TSet?,TInst?,RunType?,DT?,AdditionalInfo*,Step*,DIter*,Step*,Action*,Doc*,Summary?,TestMaintenanceSummary*,NodeArgs?) >
<!ATTLIST Doc rID ID #REQUIRED type (Test|BC|BPTWrapperTest|Flow|Group|Action) "Test" productName CDATA #REQUIRED BCIter CDATA #IMPLIED >

<!ELEMENT RunType ( #PCDATA )>
<!ATTLIST RunType fmStep (False|True) "False" batch (False|True) "False" upDesc (False|True) "False" upChk (False|True) "False" upAS (False|True) "False">

<!ELEMENT DName ( #PCDATA ) >

<!ELEMENT ConfName ( #PCDATA ) >

<!ELEMENT Res ( #PCDATA ) >

<!ELEMENT AdditionalInfo (AdditionalDataName,AdditionalDataValue ) >

<!ELEMENT AdditionalDataName ( #PCDATA ) >

<!ELEMENT AdditionalDataValue ( #PCDATA ) >

<!ELEMENT DVer ( #PCDATA ) >

<!ELEMENT TSet ( #PCDATA ) >

<!ELEMENT TInst ( #PCDATA ) >

<!ELEMENT DIter (Step*,Action+,Summary?,NodeArgs)>
<!ATTLIST DIter rID ID #REQUIRED iterID CDATA #REQUIRED>

<!ELEMENT DocLocation ( #PCDATA )>

<!ELEMENT Action (AName,AIter*,(Step|HtmlStep|Action)*, Summary,ActionMaintenanceSummary*, NodeArgs ) >
<!ATTLIST Action rID ID #REQUIRED>

<!ELEMENT AIter ((Step|HtmlStep|Action)*,DataMapping?, Summary?,NodeArgs) >
<!ATTLIST AIter rID ID #REQUIRED iterID CDATA #REQUIRED isCountable (False|True) "False" >

<!ELEMENT AName ( #PCDATA ) >

<!ELEMENT TestMaintenanceSummary (ActionMaintenanceSummary*) >
<!ATTLIST TestMaintenanceSummary ObjectsAdded CDATA #REQUIRED ObjectsUpdated CDATA #REQUIRED StepsUpdated CDATA #REQUIRED StepsComments CDATA #REQUIRED><!ELEMENT ActionMaintenanceSummary (ObjectChange* ) >
<!ATTLIST ActionMaintenanceSummary Action CDATA #REQUIRED Objects CDATA #REQUIRED Updated CDATA #REQUIRED LinesTotal CDATA #REQUIRED Added CDATA #REQUIRED LinesUpdated CDATA #REQUIRED>

<!ELEMENT ObjectChange  (Hierarchy, PropertyChangeList* ) >
<!ATTLIST ObjectChange Operation CDATA #IMPLIED OriginalRepository CDATA #IMPLIED>

<!ELEMENT PropertyChangeList (PropertyDef*) >

<!ELEMENT PropertyDef (OriginalValue, NewValue) >
<!ATTLIST PropertyDef PropName CDATA #REQUIRED OriginRegularExpression (True|False) "False" NewRegularExpression (True|False) "False" AddedProperty (True|False) "False" >

<!ELEMENT OriginalValue ( #PCDATA )>

<!ELEMENT NewValue ( #PCDATA )>

<!ELEMENT Hierarchy  (ObjectName, Hierarchy*) >
<!ATTLIST Hierarchy MicClass CDATA #REQUIRED>

<!ELEMENT ObjectName  ( #PCDATA ) >

<!ELEMENT Step (Obj,Details,Time,TimeTick* ,(Step|HtmlStep|Doc)*, DataMapping?, NodeArgs) >
<!ATTLIST Step rID ID #REQUIRED retval CDATA #IMPLIED>

<!ELEMENT HtmlStep (HTML,TimeTick*,(Step|HtmlStep|Doc)*,NodeArgs) >
<!ATTLIST HtmlStep rID ID #REQUIRED >

<!ELEMENT Obj ( #PCDATA ) >
<!ATTLIST Obj plainTxt (False|True) "True">

<!ELEMENT Details ( #PCDATA ) >
<!ATTLIST Details plainTxt (False|True) "True">

<!ELEMENT Time ( #PCDATA ) >

<!ELEMENT HTML ( #PCDATA ) >

<!ELEMENT Disp ( #PCDATA ) >

<!ELEMENT TimeTick ( #PCDATA ) >

<!ELEMENT DataMapping ( DataMappedItem* )>
<!ELEMENT DataMappedItem EMPTY >
<!ATTLIST DataMappedItem dsName CDATA #REQUIRED >
<!ATTLIST DataMappedItem rowId CDATA #REQUIRED >

<!ELEMENT NodeArgs (Disp,TopPane?,BtmPane?,ExtendedInfo? )>
<!ATTLIST NodeArgs eType CDATA #REQUIRED icon CDATA #REQUIRED nRep CDATA #REQUIRED UserNote CDATA #IMPLIED filter (False|True) "True">
<!ATTLIST NodeArgs status (Passed|Failed|Done|Warning|Information) "Done">
<!ATTLIST NodeArgs iconSel CDATA #IMPLIED nType CDATA #IMPLIED MovieMarker CDATA "">
<!ATTLIST NodeArgs Source CDATA #IMPLIED SourceLine CDATA #IMPLIED StepFlowItemKey CDATA #IMPLIED >

<!ELEMENT TopPane (Path)>

<!ELEMENT BtmPane ( (Path|WR)?,ASHilite?)>
<!ATTLIST BtmPane vType CDATA "HTML">

<!ELEMENT Path ( #PCDATA ) >

<!ELEMENT ASHilite ( #PCDATA ) >

<!ELEMENT WR ( #PCDATA ) >

<!ELEMENT ExtendedInfo ( StepData ) >

<!ATTLIST ExtendedInfo StepType CDATA #REQUIRED>
<!ELEMENT DT (NodeArgs) >
<!ATTLIST DT rID ID #REQUIRED>

<!ELEMENT Summary (Param*)>
<!ATTLIST Summary sTime CDATA #IMPLIED eTime CDATA #IMPLIED passed CDATA #IMPLIED failed CDATA #IMPLIED warnings CDATA #IMPLIED retval CDATA #IMPLIED stopped (False|True) "False" >

<!ELEMENT Param (ParamName,ParamVal)+ >
<!ATTLIST Param paramInOut (In|Out) "In">

<!ELEMENT ParamName ( #PCDATA ) >

<!ELEMENT ParamVal ( #PCDATA ) >

]
>
<Report ver="2.0" tmZone="India Standard Time">
<General productName="HPE Unified Functional Testing" productVer="14.03" os="" host="DESKTOP-UU2F52V"><DocLocation><![CDATA[F:\CAPGEMINI DOCUMENTS\DemoWebShopHybrid\TestCases\Place_Order]]></DocLocation></General>
<Doc rID="T1"   productName= "HPE Unified Functional Testing"  >
<DName><![CDATA[Place_Order]]></DName>
<Res><![CDATA[Res9]]></Res>
<DT rID="T2">
<NodeArgs eType="Table" icon="2" nRep="4" filter="False" >
<Disp><![CDATA[Run-Time Data Table]]></Disp>
<BtmPane vType="Table" >
<Path><![CDATA[Default.xls]]></Path>
</BtmPane>
</NodeArgs>
</DT>
<Step rID="T3">
<Obj plainTxt="False" ><![CDATA[Add-in(s) not activated]]></Obj>
<Details plainTxt="False" ><![CDATA[The following add-in(s) were associated with your test, but are not currently loaded: 
ActiveX, Java, WinForms.]]></Details>
<Time><![CDATA[22-09-2022 - 13:19:20]]></Time>
<TimeTick>1663832960</TimeTick>
<NodeArgs eType="Replay" icon="0" nRep="5" status="Warning" >
<Disp><![CDATA[Add-in(s) not activated]]></Disp>
</NodeArgs>
</Step>
<DIter rID="T4" iterID="1" >
<Action rID="T5">
<AName><![CDATA[placeorder]]></AName>
<Step rID="T6">
<Obj plainTxt="False" ><![CDATA[SystemUtil]]></Obj>
<Details plainTxt="False" ><![CDATA[SystemUtil]]></Details>
<Time><![CDATA[22-09-2022 - 13:19:21]]></Time>
<TimeTick>1663832961</TimeTick>
<Step rID="T7">
<Obj plainTxt="False" ><![CDATA[Run "C:\Program Files\Google\Chrome\Application\chrome.exe",1]]></Obj>
<Details plainTxt="False" ><![CDATA[Run "C:\Program Files\Google\Chrome\Application\chrome.exe",1]]></Details>
<Time><![CDATA[22-09-2022 - 13:19:21]]></Time>
<TimeTick>1663832961</TimeTick>
<NodeArgs eType="Replay" icon="5" nRep="12" status="Passed" >
<Disp><![CDATA[Run "C:\Program Files\Google\Chrome\Application\chrome.exe",1]]></Disp>
</NodeArgs>
</Step>
<NodeArgs eType="Replay" icon="5" nRep="11" status="Passed" >
<Disp><![CDATA[SystemUtil]]></Disp>
</NodeArgs>
</Step>
<Step rID="T8">
<Obj plainTxt="False" ><![CDATA[[ Log in ].Click]]></Obj>
<Details plainTxt="False" ><![CDATA[]]></Details>
<Time><![CDATA[22-09-2022 - 13:19:25]]></Time>
<TimeTick>1663832965</TimeTick>
<NodeArgs eType="Replay" icon="6" nRep="15" >
<Disp><![CDATA[[ Log in ].Click]]></Disp>
</NodeArgs>
</Step>
<Step rID="T9">
<Obj ><![CDATA['[ Log in ] link' Clicked]]></Obj>
<Details ><![CDATA[Passed]]></Details>
<Time><![CDATA[22-09-2022 - 13:19:25]]></Time>
<TimeTick>1663832965</TimeTick>
<NodeArgs eType="User" icon="7" nRep="16" status="Passed" >
<Disp><![CDATA['[ Log in ] link' Clicked]]></Disp>
</NodeArgs>
</Step>
<Step rID="T10">
<Obj plainTxt="False" ><![CDATA[[ Email ].Exist]]></Obj>
<Details plainTxt="False" ><![CDATA["Object exists"]]></Details>
<Time><![CDATA[22-09-2022 - 13:19:26]]></Time>
<TimeTick>1663832966</TimeTick>
<NodeArgs eType="Replay" icon="8" nRep="18" >
<Disp><![CDATA[[ Email ].Exist]]></Disp>
</NodeArgs>
</Step>
<Step rID="T11">
<Obj ><![CDATA[Email field is available]]></Obj>
<Details ><![CDATA[PASSED]]></Details>
<Time><![CDATA[22-09-2022 - 13:19:26]]></Time>
<TimeTick>1663832966</TimeTick>
<NodeArgs eType="User" icon="7" nRep="19" status="Passed" >
<Disp><![CDATA[Email field is available]]></Disp>
</NodeArgs>
</Step>
<Step rID="T12">
<Obj plainTxt="False" ><![CDATA[[ Email ].Set]]></Obj>
<Details plainTxt="False" ><![CDATA["Rahman@Rahman.com"]]></Details>
<Time><![CDATA[22-09-2022 - 13:19:27]]></Time>
<TimeTick>1663832967</TimeTick>
<NodeArgs eType="Replay" icon="8" nRep="22" >
<Disp><![CDATA[[ Email ].Set]]></Disp>
</NodeArgs>
</Step>
<Step rID="T13">
<Obj ><![CDATA[Value - 'Rahman@Rahman.com' entered in Field - '[ Email ] edit box']]></Obj>
<Details ><![CDATA[Passed]]></Details>
<Time><![CDATA[22-09-2022 - 13:19:27]]></Time>
<TimeTick>1663832967</TimeTick>
<NodeArgs eType="User" icon="7" nRep="23" status="Passed" >
<Disp><![CDATA[Value - 'Rahman@Rahman.com' entered in Field - '[ Email ] edit box']]></Disp>
</NodeArgs>
</Step>
<Step rID="T14">
<Obj plainTxt="False" ><![CDATA[[ Password ].Exist]]></Obj>
<Details plainTxt="False" ><![CDATA["Object exists"]]></Details>
<Time><![CDATA[22-09-2022 - 13:19:27]]></Time>
<TimeTick>1663832967</TimeTick>
<NodeArgs eType="Replay" icon="8" nRep="25" >
<Disp><![CDATA[[ Password ].Exist]]></Disp>
</NodeArgs>
</Step>
<Step rID="T15">
<Obj ><![CDATA[Email field is available]]></Obj>
<Details ><![CDATA[PASSED]]></Details>
<Time><![CDATA[22-09-2022 - 13:19:27]]></Time>
<TimeTick>1663832967</TimeTick>
<NodeArgs eType="User" icon="7" nRep="26" status="Passed" >
<Disp><![CDATA[Email field is available]]></Disp>
</NodeArgs>
</Step>
<Step rID="T16">
<Obj plainTxt="False" ><![CDATA[[ Password ].Set]]></Obj>
<Details plainTxt="False" ><![CDATA["Rahman@12345"]]></Details>
<Time><![CDATA[22-09-2022 - 13:19:27]]></Time>
<TimeTick>1663832967</TimeTick>
<NodeArgs eType="Replay" icon="8" nRep="29" >
<Disp><![CDATA[[ Password ].Set]]></Disp>
</NodeArgs>
</Step>
<Step rID="T17">
<Obj ><![CDATA[Value - 'Rahman@12345' entered in Field - '[ Password ] edit box']]></Obj>
<Details ><![CDATA[Passed]]></Details>
<Time><![CDATA[22-09-2022 - 13:19:27]]></Time>
<TimeTick>1663832967</TimeTick>
<NodeArgs eType="User" icon="7" nRep="30" status="Passed" >
<Disp><![CDATA[Value - 'Rahman@12345' entered in Field - '[ Password ] edit box']]></Disp>
</NodeArgs>
</Step>
<Step rID="T18">
<Obj plainTxt="False" ><![CDATA[[ Log in ].Exist]]></Obj>
<Details plainTxt="False" ><![CDATA["Object exists"]]></Details>
<Time><![CDATA[22-09-2022 - 13:19:27]]></Time>
<TimeTick>1663832967</TimeTick>
<NodeArgs eType="Replay" icon="9" nRep="32" >
<Disp><![CDATA[[ Log in ].Exist]]></Disp>
</NodeArgs>
</Step>
<Step rID="T19">
<Obj ><![CDATA[Login button is avaiable]]></Obj>
<Details ><![CDATA[PASSED]]></Details>
<Time><![CDATA[22-09-2022 - 13:19:27]]></Time>
<TimeTick>1663832967</TimeTick>
<NodeArgs eType="User" icon="7" nRep="33" status="Passed" >
<Disp><![CDATA[Login button is avaiable]]></Disp>
</NodeArgs>
</Step>
<Step rID="T20">
<Obj plainTxt="False" ><![CDATA[[ Log in ].Click]]></Obj>
<Details plainTxt="False" ><![CDATA[]]></Details>
<Time><![CDATA[22-09-2022 - 13:19:28]]></Time>
<TimeTick>1663832968</TimeTick>
<NodeArgs eType="Replay" icon="9" nRep="36" >
<Disp><![CDATA[[ Log in ].Click]]></Disp>
</NodeArgs>
</Step>
<Step rID="T21">
<Obj ><![CDATA['[ Log in ] button' Clicked]]></Obj>
<Details ><![CDATA[Passed]]></Details>
<Time><![CDATA[22-09-2022 - 13:19:28]]></Time>
<TimeTick>1663832968</TimeTick>
<NodeArgs eType="User" icon="7" nRep="37" status="Passed" >
<Disp><![CDATA['[ Log in ] button' Clicked]]></Disp>
</NodeArgs>
</Step>
<Step rID="T22">
<Obj plainTxt="False" ><![CDATA[[ q ].Exist]]></Obj>
<Details plainTxt="False" ><![CDATA["Object exists"]]></Details>
<Time><![CDATA[22-09-2022 - 13:19:31]]></Time>
<TimeTick>1663832971</TimeTick>
<NodeArgs eType="Replay" icon="8" nRep="39" >
<Disp><![CDATA[[ q ].Exist]]></Disp>
</NodeArgs>
</Step>
<Step rID="T23">
<Obj ><![CDATA[Search box is avaialable]]></Obj>
<Details ><![CDATA[PASSED]]></Details>
<Time><![CDATA[22-09-2022 - 13:19:31]]></Time>
<TimeTick>1663832971</TimeTick>
<NodeArgs eType="User" icon="7" nRep="40" status="Passed" >
<Disp><![CDATA[Search box is avaialable]]></Disp>
</NodeArgs>
</Step>
<Step rID="T24">
<Obj plainTxt="False" ><![CDATA[[ q ].Set]]></Obj>
<Details plainTxt="False" ><![CDATA["computer"]]></Details>
<Time><![CDATA[22-09-2022 - 13:19:31]]></Time>
<TimeTick>1663832971</TimeTick>
<NodeArgs eType="Replay" icon="8" nRep="43" >
<Disp><![CDATA[[ q ].Set]]></Disp>
</NodeArgs>
</Step>
<Step rID="T25">
<Obj ><![CDATA[Value - 'computer' entered in Field - '[ q ] edit box']]></Obj>
<Details ><![CDATA[Passed]]></Details>
<Time><![CDATA[22-09-2022 - 13:19:31]]></Time>
<TimeTick>1663832971</TimeTick>
<NodeArgs eType="User" icon="7" nRep="44" status="Passed" >
<Disp><![CDATA[Value - 'computer' entered in Field - '[ q ] edit box']]></Disp>
</NodeArgs>
</Step>
<Step rID="T26">
<Obj plainTxt="False" ><![CDATA[[ Search ].Exist]]></Obj>
<Details plainTxt="False" ><![CDATA["Object exists"]]></Details>
<Time><![CDATA[22-09-2022 - 13:19:31]]></Time>
<TimeTick>1663832971</TimeTick>
<NodeArgs eType="Replay" icon="9" nRep="46" >
<Disp><![CDATA[[ Search ].Exist]]></Disp>
</NodeArgs>
</Step>
<Step rID="T27">
<Obj ><![CDATA[Search Button is available]]></Obj>
<Details ><![CDATA[PASSED]]></Details>
<Time><![CDATA[22-09-2022 - 13:19:31]]></Time>
<TimeTick>1663832971</TimeTick>
<NodeArgs eType="User" icon="7" nRep="47" status="Passed" >
<Disp><![CDATA[Search Button is available]]></Disp>
</NodeArgs>
</Step>
<Step rID="T28">
<Obj plainTxt="False" ><![CDATA[[ Search ].Click]]></Obj>
<Details plainTxt="False" ><![CDATA[]]></Details>
<Time><![CDATA[22-09-2022 - 13:19:32]]></Time>
<TimeTick>1663832972</TimeTick>
<NodeArgs eType="Replay" icon="9" nRep="50" >
<Disp><![CDATA[[ Search ].Click]]></Disp>
</NodeArgs>
</Step>
<Step rID="T29">
<Obj ><![CDATA['[ Search ] button' Clicked]]></Obj>
<Details ><![CDATA[Passed]]></Details>
<Time><![CDATA[22-09-2022 - 13:19:32]]></Time>
<TimeTick>1663832972</TimeTick>
<NodeArgs eType="User" icon="7" nRep="51" status="Passed" >
<Disp><![CDATA['[ Search ] button' Clicked]]></Disp>
</NodeArgs>
</Step>
<Step rID="T30">
<Obj plainTxt="False" ><![CDATA[[ Build your own cheap computer ].Exist]]></Obj>
<Details plainTxt="False" ><![CDATA["Object exists"]]></Details>
<Time><![CDATA[22-09-2022 - 13:19:33]]></Time>
<TimeTick>1663832973</TimeTick>
<NodeArgs eType="Replay" icon="6" nRep="53" >
<Disp><![CDATA[[ Build your own cheap computer ].Exist]]></Disp>
</NodeArgs>
</Step>
<Step rID="T31">
<Obj ><![CDATA[Build cheap computer link is available]]></Obj>
<Details ><![CDATA[PASSED]]></Details>
<Time><![CDATA[22-09-2022 - 13:19:33]]></Time>
<TimeTick>1663832973</TimeTick>
<NodeArgs eType="User" icon="7" nRep="54" status="Passed" >
<Disp><![CDATA[Build cheap computer link is available]]></Disp>
</NodeArgs>
</Step>
<Step rID="T32">
<Obj plainTxt="False" ><![CDATA[[ Build your own cheap computer ].Click]]></Obj>
<Details plainTxt="False" ><![CDATA[]]></Details>
<Time><![CDATA[22-09-2022 - 13:19:34]]></Time>
<TimeTick>1663832974</TimeTick>
<NodeArgs eType="Replay" icon="6" nRep="57" >
<Disp><![CDATA[[ Build your own cheap computer ].Click]]></Disp>
</NodeArgs>
</Step>
<Step rID="T33">
<Obj ><![CDATA['[ Build your own cheap computer ] link' Clicked]]></Obj>
<Details ><![CDATA[Passed]]></Details>
<Time><![CDATA[22-09-2022 - 13:19:34]]></Time>
<TimeTick>1663832974</TimeTick>
<NodeArgs eType="User" icon="7" nRep="58" status="Passed" >
<Disp><![CDATA['[ Build your own cheap computer ] link' Clicked]]></Disp>
</NodeArgs>
</Step>
<Step rID="T34">
<Obj plainTxt="False" ><![CDATA[[ product_attribute_72_5_18 ].Exist]]></Obj>
<Details plainTxt="False" ><![CDATA["Object exists"]]></Details>
<Time><![CDATA[22-09-2022 - 13:19:36]]></Time>
<TimeTick>1663832976</TimeTick>
<NodeArgs eType="Replay" icon="10" nRep="60" >
<Disp><![CDATA[[ product_attribute_72_5_18 ].Exist]]></Disp>
</NodeArgs>
</Step>
<Step rID="T35">
<Obj ><![CDATA[Processor Radio group is available]]></Obj>
<Details ><![CDATA[PASSED]]></Details>
<Time><![CDATA[22-09-2022 - 13:19:36]]></Time>
<TimeTick>1663832976</TimeTick>
<NodeArgs eType="User" icon="7" nRep="61" status="Passed" >
<Disp><![CDATA[Processor Radio group is available]]></Disp>
</NodeArgs>
</Step>
<Step rID="T36">
<Obj plainTxt="False" ><![CDATA[[ product_attribute_72_5_18 ].Select]]></Obj>
<Details plainTxt="False" ><![CDATA["52"]]></Details>
<Time><![CDATA[22-09-2022 - 13:19:37]]></Time>
<TimeTick>1663832977</TimeTick>
<NodeArgs eType="Replay" icon="10" nRep="64" >
<Disp><![CDATA[[ product_attribute_72_5_18 ].Select]]></Disp>
</NodeArgs>
</Step>
<Step rID="T37">
<Obj ><![CDATA[Value - '52' selected from Drop Down Field - '[ product_attribute_72_5_18 ] radio button group']]></Obj>
<Details ><![CDATA[Passed]]></Details>
<Time><![CDATA[22-09-2022 - 13:19:37]]></Time>
<TimeTick>1663832977</TimeTick>
<NodeArgs eType="User" icon="7" nRep="65" status="Passed" >
<Disp><![CDATA[Value - '52' selected from Drop Down Field - '[ product_attribute_72_5_18 ] radio button group']]></Disp>
</NodeArgs>
</Step>
<Step rID="T38">
<Obj plainTxt="False" ><![CDATA[[ product_attribute_72_6_19 ].Exist]]></Obj>
<Details plainTxt="False" ><![CDATA["Object exists"]]></Details>
<Time><![CDATA[22-09-2022 - 13:19:37]]></Time>
<TimeTick>1663832977</TimeTick>
<NodeArgs eType="Replay" icon="10" nRep="67" >
<Disp><![CDATA[[ product_attribute_72_6_19 ].Exist]]></Disp>
</NodeArgs>
</Step>
<Step rID="T39">
<Obj ><![CDATA[RAM Radio group is available]]></Obj>
<Details ><![CDATA[PASSED]]></Details>
<Time><![CDATA[22-09-2022 - 13:19:37]]></Time>
<TimeTick>1663832977</TimeTick>
<NodeArgs eType="User" icon="7" nRep="68" status="Passed" >
<Disp><![CDATA[RAM Radio group is available]]></Disp>
</NodeArgs>
</Step>
<Step rID="T40">
<Obj plainTxt="False" ><![CDATA[[ product_attribute_72_6_19 ].Select]]></Obj>
<Details plainTxt="False" ><![CDATA["55"]]></Details>
<Time><![CDATA[22-09-2022 - 13:19:37]]></Time>
<TimeTick>1663832977</TimeTick>
<NodeArgs eType="Replay" icon="10" nRep="71" >
<Disp><![CDATA[[ product_attribute_72_6_19 ].Select]]></Disp>
</NodeArgs>
</Step>
<Step rID="T41">
<Obj ><![CDATA[Value - '55' selected from Drop Down Field - '[ product_attribute_72_6_19 ] radio button group']]></Obj>
<Details ><![CDATA[Passed]]></Details>
<Time><![CDATA[22-09-2022 - 13:19:37]]></Time>
<TimeTick>1663832977</TimeTick>
<NodeArgs eType="User" icon="7" nRep="72" status="Passed" >
<Disp><![CDATA[Value - '55' selected from Drop Down Field - '[ product_attribute_72_6_19 ] radio button group']]></Disp>
</NodeArgs>
</Step>
<Step rID="T42">
<Obj plainTxt="False" ><![CDATA[[ product_attribute_72_3_20 ].Exist]]></Obj>
<Details plainTxt="False" ><![CDATA["Object exists"]]></Details>
<Time><![CDATA[22-09-2022 - 13:19:37]]></Time>
<TimeTick>1663832977</TimeTick>
<NodeArgs eType="Replay" icon="10" nRep="74" >
<Disp><![CDATA[[ product_attribute_72_3_20 ].Exist]]></Disp>
</NodeArgs>
</Step>
<Step rID="T43">
<Obj ><![CDATA[RAM Radio group is available]]></Obj>
<Details ><![CDATA[PASSED]]></Details>
<Time><![CDATA[22-09-2022 - 13:19:37]]></Time>
<TimeTick>1663832977</TimeTick>
<NodeArgs eType="User" icon="7" nRep="75" status="Passed" >
<Disp><![CDATA[RAM Radio group is available]]></Disp>
</NodeArgs>
</Step>
<Step rID="T44">
<Obj plainTxt="False" ><![CDATA[[ product_attribute_72_3_20 ].Select]]></Obj>
<Details plainTxt="False" ><![CDATA["58"]]></Details>
<Time><![CDATA[22-09-2022 - 13:19:38]]></Time>
<TimeTick>1663832978</TimeTick>
<NodeArgs eType="Replay" icon="10" nRep="78" >
<Disp><![CDATA[[ product_attribute_72_3_20 ].Select]]></Disp>
</NodeArgs>
</Step>
<Step rID="T45">
<Obj ><![CDATA[Value - '58' selected from Drop Down Field - '[ product_attribute_72_3_20 ] radio button group']]></Obj>
<Details ><![CDATA[Passed]]></Details>
<Time><![CDATA[22-09-2022 - 13:19:38]]></Time>
<TimeTick>1663832978</TimeTick>
<NodeArgs eType="User" icon="7" nRep="79" status="Passed" >
<Disp><![CDATA[Value - '58' selected from Drop Down Field - '[ product_attribute_72_3_20 ] radio button group']]></Disp>
</NodeArgs>
</Step>
<Step rID="T46">
<Obj plainTxt="False" ><![CDATA[[ product_attribute_72_8_30 ].Exist]]></Obj>
<Details plainTxt="False" ><![CDATA["Object exists"]]></Details>
<Time><![CDATA[22-09-2022 - 13:19:38]]></Time>
<TimeTick>1663832978</TimeTick>
<NodeArgs eType="Replay" icon="11" nRep="81" >
<Disp><![CDATA[[ product_attribute_72_8_30 ].Exist]]></Disp>
</NodeArgs>
</Step>
<Step rID="T47">
<Obj ><![CDATA[Office Suite CheckBox Exist]]></Obj>
<Details ><![CDATA[PASSED]]></Details>
<Time><![CDATA[22-09-2022 - 13:19:38]]></Time>
<TimeTick>1663832978</TimeTick>
<NodeArgs eType="User" icon="7" nRep="82" status="Passed" >
<Disp><![CDATA[Office Suite CheckBox Exist]]></Disp>
</NodeArgs>
</Step>
<Step rID="T48">
<Obj plainTxt="False" ><![CDATA[[ product_attribute_72_8_30 ].Set]]></Obj>
<Details plainTxt="False" ><![CDATA["ON"]]></Details>
<Time><![CDATA[22-09-2022 - 13:19:38]]></Time>
<TimeTick>1663832978</TimeTick>
<NodeArgs eType="Replay" icon="11" nRep="85" >
<Disp><![CDATA[[ product_attribute_72_8_30 ].Set]]></Disp>
</NodeArgs>
</Step>
<Step rID="T49">
<Obj ><![CDATA['[ product_attribute_72_8_30 ] check box' Clicked]]></Obj>
<Details ><![CDATA[Passed]]></Details>
<Time><![CDATA[22-09-2022 - 13:19:38]]></Time>
<TimeTick>1663832978</TimeTick>
<NodeArgs eType="User" icon="7" nRep="86" status="Passed" >
<Disp><![CDATA['[ product_attribute_72_8_30 ] check box' Clicked]]></Disp>
</NodeArgs>
</Step>
<Step rID="T50">
<Obj plainTxt="False" ><![CDATA[[ addtocart_72.EnteredQuantity ].Exist]]></Obj>
<Details plainTxt="False" ><![CDATA["Object exists"]]></Details>
<Time><![CDATA[22-09-2022 - 13:19:38]]></Time>
<TimeTick>1663832978</TimeTick>
<NodeArgs eType="Replay" icon="8" nRep="88" >
<Disp><![CDATA[[ addtocart_72.EnteredQuantity ].Exist]]></Disp>
</NodeArgs>
</Step>
<Step rID="T51">
<Obj ><![CDATA[Quantity field is available]]></Obj>
<Details ><![CDATA[PASSED]]></Details>
<Time><![CDATA[22-09-2022 - 13:19:38]]></Time>
<TimeTick>1663832978</TimeTick>
<NodeArgs eType="User" icon="7" nRep="89" status="Passed" >
<Disp><![CDATA[Quantity field is available]]></Disp>
</NodeArgs>
</Step>
<Step rID="T52">
<Obj plainTxt="False" ><![CDATA[[ addtocart_72.EnteredQuantity ]]]></Obj>
<Details plainTxt="False" ><![CDATA[WebEdit]]></Details>
<Time><![CDATA[22-09-2022 - 13:19:39]]></Time>
<TimeTick>1663832979</TimeTick>
<Step rID="T53">
<Obj plainTxt="False" ><![CDATA["[ addtocart_72.EnteredQuantity ]"]]></Obj>
<Details plainTxt="False" ><![CDATA[Property &quot;type&quot; has the expected value: &quot;text&quot;.]]></Details>
<Time><![CDATA[22-09-2022 - 13:19:39]]></Time>
<TimeTick>1663832979</TimeTick>
<NodeArgs eType="Replay" icon="8" nRep="92" status="Passed" nType="CheckProperty" >
<Disp><![CDATA["[ addtocart_72.EnteredQuantity ]"]]></Disp>
</NodeArgs>
</Step>
<NodeArgs eType="Context" icon="8" nRep="91" status="Passed" >
<Disp><![CDATA[[ addtocart_72.EnteredQuantity ]]]></Disp>
</NodeArgs>
</Step>
<Step rID="T54">
<Obj plainTxt="False" ><![CDATA[[ addtocart_72.EnteredQuantity ]]]></Obj>
<Details plainTxt="False" ><![CDATA[WebEdit]]></Details>
<Time><![CDATA[22-09-2022 - 13:19:39]]></Time>
<TimeTick>1663832979</TimeTick>
<Step rID="T55">
<Obj plainTxt="False" ><![CDATA["[ addtocart_72.EnteredQuantity ]"]]></Obj>
<Details plainTxt="False" ><![CDATA[Property &quot;value&quot; has the expected value: 1.]]></Details>
<Time><![CDATA[22-09-2022 - 13:19:39]]></Time>
<TimeTick>1663832979</TimeTick>
<NodeArgs eType="Replay" icon="8" nRep="95" status="Passed" nType="CheckProperty" >
<Disp><![CDATA["[ addtocart_72.EnteredQuantity ]"]]></Disp>
</NodeArgs>
</Step>
<NodeArgs eType="Context" icon="8" nRep="94" status="Passed" >
<Disp><![CDATA[[ addtocart_72.EnteredQuantity ]]]></Disp>
</NodeArgs>
</Step>
<Step rID="T56">
<Obj plainTxt="False" ><![CDATA[[ addtocart_72.EnteredQuantity ]]]></Obj>
<Details plainTxt="False" ><![CDATA[WebEdit]]></Details>
<Time><![CDATA[22-09-2022 - 13:19:39]]></Time>
<TimeTick>1663832979</TimeTick>
<Step rID="T57">
<Obj plainTxt="False" ><![CDATA["[ addtocart_72.EnteredQuantity ]"]]></Obj>
<Details plainTxt="False" ><![CDATA[Property &quot;visible&quot; has the expected value: True.]]></Details>
<Time><![CDATA[22-09-2022 - 13:19:39]]></Time>
<TimeTick>1663832979</TimeTick>
<NodeArgs eType="Replay" icon="8" nRep="98" status="Passed" nType="CheckProperty" >
<Disp><![CDATA["[ addtocart_72.EnteredQuantity ]"]]></Disp>
</NodeArgs>
</Step>
<NodeArgs eType="Context" icon="8" nRep="97" status="Passed" >
<Disp><![CDATA[[ addtocart_72.EnteredQuantity ]]]></Disp>
</NodeArgs>
</Step>
<Step rID="T58">
<Obj plainTxt="False" ><![CDATA[[ addtocart_72.EnteredQuantity ]]]></Obj>
<Details plainTxt="False" ><![CDATA[WebEdit]]></Details>
<Time><![CDATA[22-09-2022 - 13:19:39]]></Time>
<TimeTick>1663832979</TimeTick>
<Step rID="T59">
<Obj plainTxt="False" ><![CDATA["[ addtocart_72.EnteredQuantity ]"]]></Obj>
<Details plainTxt="False" ><![CDATA[Property &quot;kind&quot; has the expected value: &quot;singleline&quot;.]]></Details>
<Time><![CDATA[22-09-2022 - 13:19:39]]></Time>
<TimeTick>1663832979</TimeTick>
<NodeArgs eType="Replay" icon="8" nRep="101" status="Passed" nType="CheckProperty" >
<Disp><![CDATA["[ addtocart_72.EnteredQuantity ]"]]></Disp>
</NodeArgs>
</Step>
<NodeArgs eType="Context" icon="8" nRep="100" status="Passed" >
<Disp><![CDATA[[ addtocart_72.EnteredQuantity ]]]></Disp>
</NodeArgs>
</Step>
<Step rID="T60">
<Obj plainTxt="False" ><![CDATA[[ addtocart_72.EnteredQuantity ].Set]]></Obj>
<Details plainTxt="False" ><![CDATA["1"]]></Details>
<Time><![CDATA[22-09-2022 - 13:19:39]]></Time>
<TimeTick>1663832979</TimeTick>
<NodeArgs eType="Replay" icon="8" nRep="104" >
<Disp><![CDATA[[ addtocart_72.EnteredQuantity ].Set]]></Disp>
</NodeArgs>
</Step>
<Step rID="T61">
<Obj ><![CDATA[Value - '1' entered in Field - '[ addtocart_72.EnteredQuantity ] edit box']]></Obj>
<Details ><![CDATA[Passed]]></Details>
<Time><![CDATA[22-09-2022 - 13:19:39]]></Time>
<TimeTick>1663832979</TimeTick>
<NodeArgs eType="User" icon="7" nRep="105" status="Passed" >
<Disp><![CDATA[Value - '1' entered in Field - '[ addtocart_72.EnteredQuantity ] edit box']]></Disp>
</NodeArgs>
</Step>
<Step rID="T62">
<Obj plainTxt="False" ><![CDATA[[ 800.00  ].Exist]]></Obj>
<Details plainTxt="False" ><![CDATA["Object exists"]]></Details>
<Time><![CDATA[22-09-2022 - 13:19:39]]></Time>
<TimeTick>1663832979</TimeTick>
<NodeArgs eType="Replay" icon="12" nRep="107" >
<Disp><![CDATA[[ 800.00  ].Exist]]></Disp>
</NodeArgs>
</Step>
<Step rID="T63">
<Obj ><![CDATA[Price is displayed]]></Obj>
<Details ><![CDATA[PASSED]]></Details>
<Time><![CDATA[22-09-2022 - 13:19:39]]></Time>
<TimeTick>1663832979</TimeTick>
<NodeArgs eType="User" icon="7" nRep="108" status="Passed" >
<Disp><![CDATA[Price is displayed]]></Disp>
</NodeArgs>
</Step>
<Step rID="T64">
<Obj plainTxt="False" ><![CDATA[[ Add to cart ].Exist]]></Obj>
<Details plainTxt="False" ><![CDATA["Object exists"]]></Details>
<Time><![CDATA[22-09-2022 - 13:19:40]]></Time>
<TimeTick>1663832980</TimeTick>
<NodeArgs eType="Replay" icon="9" nRep="111" >
<Disp><![CDATA[[ Add to cart ].Exist]]></Disp>
</NodeArgs>
</Step>
<Step rID="T65">
<Obj ><![CDATA[Add to cart button is available]]></Obj>
<Details ><![CDATA[PASSED]]></Details>
<Time><![CDATA[22-09-2022 - 13:19:40]]></Time>
<TimeTick>1663832980</TimeTick>
<NodeArgs eType="User" icon="7" nRep="112" status="Passed" >
<Disp><![CDATA[Add to cart button is available]]></Disp>
</NodeArgs>
</Step>
<Step rID="T66">
<Obj plainTxt="False" ><![CDATA[[ Add to cart ]]]></Obj>
<Details plainTxt="False" ><![CDATA[WebButton]]></Details>
<Time><![CDATA[22-09-2022 - 13:19:40]]></Time>
<TimeTick>1663832980</TimeTick>
<Step rID="T67">
<Obj plainTxt="False" ><![CDATA["[ Add to cart ]"]]></Obj>
<Details plainTxt="False" ><![CDATA[Property &quot;type&quot; has the expected value: &quot;button&quot;.]]></Details>
<Time><![CDATA[22-09-2022 - 13:19:40]]></Time>
<TimeTick>1663832980</TimeTick>
<NodeArgs eType="Replay" icon="9" nRep="115" status="Passed" nType="CheckProperty" >
<Disp><![CDATA["[ Add to cart ]"]]></Disp>
</NodeArgs>
</Step>
<NodeArgs eType="Context" icon="9" nRep="114" status="Passed" >
<Disp><![CDATA[[ Add to cart ]]]></Disp>
</NodeArgs>
</Step>
<Step rID="T68">
<Obj plainTxt="False" ><![CDATA[[ Add to cart ]]]></Obj>
<Details plainTxt="False" ><![CDATA[WebButton]]></Details>
<Time><![CDATA[22-09-2022 - 13:19:40]]></Time>
<TimeTick>1663832980</TimeTick>
<Step rID="T69">
<Obj plainTxt="False" ><![CDATA["[ Add to cart ]"]]></Obj>
<Details plainTxt="False" ><![CDATA[Property &quot;value&quot; has the expected value: &quot;Add to cart&quot;.]]></Details>
<Time><![CDATA[22-09-2022 - 13:19:40]]></Time>
<TimeTick>1663832980</TimeTick>
<NodeArgs eType="Replay" icon="9" nRep="118" status="Passed" nType="CheckProperty" >
<Disp><![CDATA["[ Add to cart ]"]]></Disp>
</NodeArgs>
</Step>
<NodeArgs eType="Context" icon="9" nRep="117" status="Passed" >
<Disp><![CDATA[[ Add to cart ]]]></Disp>
</NodeArgs>
</Step>
<Step rID="T70">
<Obj plainTxt="False" ><![CDATA[[ Add to cart ]]]></Obj>
<Details plainTxt="False" ><![CDATA[WebButton]]></Details>
<Time><![CDATA[22-09-2022 - 13:19:40]]></Time>
<TimeTick>1663832980</TimeTick>
<Step rID="T71">
<Obj plainTxt="False" ><![CDATA["[ Add to cart ]"]]></Obj>
<Details plainTxt="False" ><![CDATA[Property &quot;visible&quot; has the expected value: True.]]></Details>
<Time><![CDATA[22-09-2022 - 13:19:40]]></Time>
<TimeTick>1663832980</TimeTick>
<NodeArgs eType="Replay" icon="9" nRep="121" status="Passed" nType="CheckProperty" >
<Disp><![CDATA["[ Add to cart ]"]]></Disp>
</NodeArgs>
</Step>
<NodeArgs eType="Context" icon="9" nRep="120" status="Passed" >
<Disp><![CDATA[[ Add to cart ]]]></Disp>
</NodeArgs>
</Step>
<Step rID="T72">
<Obj plainTxt="False" ><![CDATA[[ Add to cart ].Click]]></Obj>
<Details plainTxt="False" ><![CDATA[]]></Details>
<Time><![CDATA[22-09-2022 - 13:19:40]]></Time>
<TimeTick>1663832980</TimeTick>
<NodeArgs eType="Replay" icon="9" nRep="124" >